{
  "beats_ref": "artifacts/scenes/scene_018.beats.json",
  "cast": [
    "Elias"
  ],
  "chapter_no": 6,
  "goal": "Find peace after the ordeal.",
  "scene_id": 18,
  "setting": {
    "location_id": "apartment_living_room",
    "mood_tags": [
      "peaceful"
    ],
    "time": "day"
  },
  "stakes": "None",
  "title": "Resolution"
}
